[
  {
    "source_url": "https://rmfyalk.court.gov.cn/view/content.html?id=pjDdqcz4RCOmjDVj%252BWs9xHEEbnyBLZuh9qP72uh1iys%253D&lib=ck",
    "title": "廖某诉某<em>劳</em>务派遣公司<em>确</em><em>认</em><em>劳</em><em>动</em><em>关</em><em>系</em>纠纷案",
    "keyword": "确认劳动关系",
    "page": 1,
    "source_domain": "rmfyalk.court.gov.cn",
    "discovered_at": "2026-08-22T21:01:08.434804+00:00",
    "status": "discovered"
  },
  {
    "source_url": "https://rmfyalk.court.gov.cn/view/content.html?id=DfpZiJXBUeSnAThrt%252ByapwfW4m%252B53RK7O3zYZWAa%252FUo%253D&lib=zdx",
    "title": "指导案例179号：聂美兰诉北京林氏兄弟文化有限公司<em>确</em><em>认</em><em>劳</em><em>动</em><em>关</em><em>系</em>案",
    "keyword": "确认劳动关系",
    "page": 1,
    "source_domain": "rmfyalk.court.gov.cn",
    "discovered_at": "2026-08-22T21:01:08.434804+00:00",
    "status": "discovered"
  },
  {
    "source_url": "https://rmfyalk.court.gov.cn/view/content.html?id=s549hK1VLD9RLUOPsJVtgmdwB3TWBtZi8QkDuwM5Y9Y%253D&lib=zdx",
    "title": "指导性案例237号：郎溪某服务外包有限公司诉徐某申<em>确</em><em>认</em><em>劳</em><em>动</em><em>关</em><em>系</em>纠纷案",
    "keyword": "确认劳动关系",
    "page": 1,
    "source_domain": "rmfyalk.court.gov.cn",
    "discovered_at": "2026-08-22T21:01:08.434804+00:00",
    "status": "discovered"
  },
  {
    "source_url": "https://rmfyalk.court.gov.cn/view/content.html?id=uPm1oEvBzbRberd5P1JspLdndEawFhS2XCpUzT5jmPQ%253D&lib=zdx",
    "title": "指导性案例238号：圣某欢诉江苏某网络科技有限公司<em>确</em><em>认</em><em>劳</em><em>动</em><em>关</em><em>系</em>纠纷案",
    "keyword": "确认劳动关系",
    "page": 1,
    "source_domain": "rmfyalk.court.gov.cn",
    "discovered_at": "2026-08-22T21:01:08.434804+00:00",
    "status": "discovered"
  },
  {
    "source_url": "https://rmfyalk.court.gov.cn/view/content.html?id=fjS3B3Qswwa0U4bBDGaFwJK6JaryOdJQEhXm8Hna0zA%253D&lib=zdx",
    "title": "指导性案例239号：王某诉北京某文化传媒有限公司劳动争议案",
    "keyword": "确认劳动关系",
    "page": 1,
    "source_domain": "rmfyalk.court.gov.cn",
    "discovered_at": "2026-08-22T21:01:08.434804+00:00",
    "status": "discovered"
  },
  {
    "source_url": "https://rmfyalk.court.gov.cn/view/content.html?id=Be6LB4kZB2ar8q4OKXfDpw8gCrIVHdxqVcnOPgu8eys%253D&lib=zdx",
    "title": "指导性案例240号：秦某丹诉北京某汽车技术开发服务有限公司劳动争议案",
    "keyword": "确认劳动关系",
    "page": 1,
    "source_domain": "rmfyalk.court.gov.cn",
    "discovered_at": "2026-08-22T21:01:08.434804+00:00",
    "status": "discovered"
  },
  {
    "source_url": "https://rmfyalk.court.gov.cn/view/content.html?id=UK191MAwTu%252Bs%252FljHMPWohSCu9UpnOnGR%252FLVtw8Bxpk8%253D&lib=ck",
    "title": "何某诉某商务服务公司、某商务服务公司广州分公司<em>确</em><em>认</em><em>劳</em><em>动</em><em>关</em><em>系</em>纠纷案",
    "keyword": "确认劳动关系",
    "page": 1,
    "source_domain": "rmfyalk.court.gov.cn",
    "discovered_at": "2026-08-22T21:01:08.435875+00:00",
    "status": "discovered"
  },
  {
    "source_url": "https://rmfyalk.court.gov.cn/view/content.html?id=jIqbCz1uo8s7oosNMRP7npsd2%252BM4eYGUF%252B3ezW6s0mo%253D&lib=ck",
    "title": "广东省良某食品有限公司诉余某劳动争议纠纷案",
    "keyword": "确认劳动关系",
    "page": 1,
    "source_domain": "rmfyalk.court.gov.cn",
    "discovered_at": "2026-08-22T21:01:08.435875+00:00",
    "status": "discovered"
  },
  {
    "source_url": "https://rmfyalk.court.gov.cn/view/content.html?id=pxMbK2b9zuo3nJX9fv3zyqGZosSD5G%252FKVJnGDOWDrnA%253D&lib=ck",
    "title": "陈某某诉辽源市某物流有限公司劳动争议案",
    "keyword": "确认劳动关系",
    "page": 1,
    "source_domain": "rmfyalk.court.gov.cn",
    "discovered_at": "2026-08-22T21:01:08.435875+00:00",
    "status": "discovered"
  },
  {
    "source_url": "https://rmfyalk.court.gov.cn/view/content.html?id=bkqi%252Bk0s3Vx58BWMz%252FZ4pSpxb3tKNzCulNGH31VeKXQ%253D&lib=ck",
    "title": "杨某诉某科技公司劳动争议纠纷案",
    "keyword": "确认劳动关系",
    "page": 1,
    "source_domain": "rmfyalk.court.gov.cn",
    "discovered_at": "2026-08-22T21:01:08.435875+00:00",
    "status": "discovered"
  },
  {
    "source_url": "https://rmfyalk.court.gov.cn/view/content.html?id=3q2DZRHaPUodi0Fww23xSD9t%252BlUbdU7Xzmhhri722XY%253D&lib=qb",
    "title": "首例确认试管婴儿享受工亡抚恤金案",
    "keyword": "确认劳动关系",
    "page": 1,
    "source_domain": "rmfyalk.court.gov.cn",
    "discovered_at": "2026-08-22T21:01:08.959972+00:00",
    "status": "discovered"
  },
  {
    "source_url": "https://rmfyalk.court.gov.cn/view/content.html?id=5g9GYKBTMqddWkOX8idTbuxRZcRJ7XYxTIUtGxrnjW0%253D&lib=qb",
    "title": "订婚强奸案",
    "keyword": "确认劳动关系",
    "page": 1,
    "source_domain": "rmfyalk.court.gov.cn",
    "discovered_at": "2026-08-22T21:01:08.959972+00:00",
    "status": "discovered"
  },
  {
    "source_url": "https://rmfyalk.court.gov.cn/view/content.html?id=ztY5L0S1oyAlG8iXag8HZ5fRReYYEZPNos9rXW7S4c4%253D&lib=qb",
    "title": "初中生杀害同学埋尸案",
    "keyword": "确认劳动关系",
    "page": 1,
    "source_domain": "rmfyalk.court.gov.cn",
    "discovered_at": "2026-08-22T21:01:08.959972+00:00",
    "status": "discovered"
  }
]
